Review,Title,Rating,day,month,year,hour,minute,second,dayofweek,weekofyear,raw time,Country,Username,Reviews,Reads,Useful,Genre
"Need to know when the contact being called can not be reached, instead of ringing all through while the contact is not switched off, also be able to delete calls recieve, make and miss calls",Need improvement,3,2,12,2014,14,37,7,2,49,2014-12-02T14:37:07,United States,Juliet Eribo,1,0,0,
"Rebtel unfortunately has the worst customer service system and personnel. I have been a loyal customer of Rebtel for a long time but sadly, on several occasions that I had billing problems with my account, The customer service turns the other way. I am constantly treated like an unwelcome customer. Obviously, my business is not valued neither does my experience matter.",What a shame!,1,2,12,2014,14,4,39,2,49,2014-12-02T14:04:39,United States,JOY iwunze,1,0,0,
"I been using rebtel for many years. I love how clear the communication is. I have used it for Cuba, Colombia, Mexico, and Venezuela. I love how simple it is to call a family member anywhere in the world.",I love rebtel is super easy to use and so clear to hear.,5,2,12,2014,13,58,28,2,49,2014-12-02T13:58:28,United States,kelly,1,0,0,
"Rebtel is an app for everyone, it's cheaper to make international calls and send text messages.  It's about one of the few apps that you can use to top up for loved ones and family and it's easy to use.",Rebtel: app for all,5,2,12,2014,13,13,38,2,49,2014-12-02T13:13:38,United Kingdom,Mr Emie Abugo,1,0,0,
"I love everything about rebtel, I can recommend it to anyone that calls international countries, just that there rate needs to go down on some countries.",Rebtel is awesome and easy to make calls from.,4,2,12,2014,12,59,19,2,49,2014-12-02T12:59:19,United States,saheed,1,0,0,
Disgusting site. Its been 3 times. This site is using my card information and very frequently money gets deducted from my account. Called its toll free number which again goes to some other company's call center. So don't use this site...,FAKE FAKE FAKE,1,2,12,2014,12,48,59,2,49,2014-12-02T12:48:59,Canada,HARMANPREET,2,0,0,
It's a very nice app. Allows me to talk to my family and friends for a long time and the network is always clear. Thank God for Rebtel,Fantastic,4,2,12,2014,12,28,6,2,49,2014-12-02T12:28:06,United States,Temitope,1,0,0,
Its very easy to use and has good voice quality.,works great!!!,4,2,12,2014,12,13,48,2,49,2014-12-02T12:13:48,United States,hiro,1,0,0,
"Rebtel has so far proved to be a very reliable service, that offers prompt customer care. I'm fully satisfied with Rebtel.",Very reliable service,5,2,12,2014,11,19,37,2,49,2014-12-02T11:19:37,United States,Sarah,1,0,0,
Rebtel allow me to talk to my terminally ill mother every day on the go.,Saved my life.,4,2,12,2014,10,19,38,2,49,2014-12-02T10:19:38,Australia,Daniela,1,0,0,
"I am using rebtel since 7 years., It's very clear and cheap rates, good connection, I recommended rebtel to my family & friends",Good One to interact globally !,5,2,12,2014,10,9,16,2,49,2014-12-02T10:09:16,United States,Neeraja,1,0,0,
This is a really good voip service. I would say best of the lot. No cross connections or waiting or unnecessary disturbances. Just load money and keep speaking. Really hassle free.,voice clarity as good as a base/ landphone,5,2,12,2014,10,8,48,2,49,2014-12-02T10:08:48,Netherlands,tara,1,0,0,
Bad reception most times,Not bad could be better though,3,2,12,2014,10,6,38,2,49,2014-12-02T10:06:38,United Kingdom,Mr Ogor Peters,1,0,0,
Great service to call our daughter. Recommend!,Great!,5,2,12,2014,7,22,22,2,49,2014-12-02T07:22:22,Bulgaria,Христо Георгиев,1,0,1,
"Been a customer since 2012...been a good journey so far. Yea..there were few technical glitches at times, but fully satisfied with the service.",Value for money !!,5,2,12,2014,5,19,36,2,49,2014-12-02T05:19:36,United States,chandana,1,0,0,
"I really appreciate the cheap calls that are available. It is a great value. My only complaint would be the ads that pop up an interrupt my calls and cost me a minute. If I were going to invite someone I would have already, the person who I call can't use the service. Other than that it's great call quality. Just hate losing minutes.",Blessedly cheap,4,2,12,2014,3,30,29,2,49,2014-12-02T03:30:29,United States,Dichrista,1,0,0,
"The service provides good value and is very easy to use. Their app is what makes it best for me, since there is no dialing a third party number and then putting in the destination number.",Quick international calls at a good value!,5,1,12,2014,15,39,52,1,49,2014-12-01T15:39:52,United States,Sree,1,0,0,
I've tried many calling services and rebtel is the absolute best! Great app and great rates.,Awesome,5,1,12,2014,15,37,2,1,49,2014-12-01T15:37:02,Sweden,Daniel Gogov,1,0,0,
"Been using rebtel for more than 4 years and like the service because its very reliable for international calls. The app is just ""ok"" but the quality of the service is the best feature and the ability to store many numbers as local numbers to call your contacts. All in all an Excellent platform for international calls with room for improvement especially with the mobile app and calling rates.","Simple, straightforward and very reliable",4,1,12,2014,14,19,33,1,49,2014-12-01T14:19:33,United States,Ikenna,1,0,0,
Buen servicio aunque a veces problemas en la linea nunca se si el otro telefono esta apagado siempreda senal,Good service,4,1,12,2014,11,13,51,1,49,2014-12-01T11:13:51,United Kingdom,sergio,1,0,0,
"cheap international calls, everyone should try it!",Awesome!,5,1,12,2014,11,2,24,1,49,2014-12-01T11:02:24,Sweden,Evelina Rask,1,0,0,
I did not like Rebtel when it hiked the price of 1000 mins India call time to $14.99. I feel cheated by initially offering cheap price and then exponential increasing the cost,expensive,1,1,12,2014,7,14,13,1,49,2014-12-01T07:14:13,United States,Suresh,1,0,0,
Advising all my friends to start using rebtel,nice and cheap,5,1,12,2014,1,43,14,1,49,2014-12-01T01:43:14,Canada,arinze,1,0,0,
"I have enjoyed using rebtel to make international calls, simply add credit and then dial out anywhere. The price is fair, and most importantly if at all there has been a issue with calling, they reimburse you for that. Overall ben a great experience, no more calling card or inconvenient calling tools",Very good,4,30,11,2014,18,55,20,7,48,2014-11-30T18:55:20,Canada,Harinder,1,0,0,
If you need to keep up with family members that do not have computers Rebtel is perfect for the task. It is stable with fewer drop calls then other services and it is easy to reload credit.,Great for International Calls to Mobile Phones,4,30,11,2014,17,12,59,7,48,2014-11-30T17:12:59,Canada,User New York / Toronto,1,0,0,
"You should try rebtel,  they are cheaper than most providers",great service,5,30,11,2014,8,41,58,7,48,2014-11-30T08:41:58,United States,Roosevelt,1,0,0,
It seems that the India Big Saver rate is increased when compared to previous offer.,Good,4,30,11,2014,5,3,37,7,48,2014-11-30T05:03:37,Singapore,Babu,1,0,0,
"I love rebtel for its uninterrupted connection anytime, including the fact that I can call foreign numbers without local numbers again. It's awesome.",excellent.,5,30,11,2014,2,33,31,7,48,2014-11-30T02:33:31,United States,Grace,1,0,0,
I wanna invite my friends here without any doubt.,I am really happy with the service,5,29,11,2014,20,22,57,6,48,2014-11-29T20:22:57,Saudi Arabia,Muhammad,1,0,0,
Good to use but Cameroon calls and European cell phone very expensive,good to use but calls still very expensive in most African countries,3,29,11,2014,19,43,28,6,48,2014-11-29T19:43:28,United States,Caroline   vemma,1,0,0,
easy to use .. but every recharge dey charge u international transaction charge on ur card..good is.. free callin from rebtel to rebtle..,easy to use .. but every recharge dey charge u international transaction charge on ur card..good is free callin from rebtel to rebtle,4,29,11,2014,16,14,21,6,48,2014-11-29T16:14:21,United States,Puneet,1,0,0,
"I have used Rebtel for years, almost since its inception and I have been very pleased.",Tested and trusted,4,29,11,2014,12,56,18,6,48,2014-11-29T12:56:18,United States,babatunde,1,0,0,
The convenience of having rebtel App on my phone just makes life easy when it comes to staying in touch with family member and friends.,Rebtel is convenient to use and the call quality is excellent.,4,29,11,2014,12,25,11,6,48,2014-11-29T12:25:11,Canada,Daniel,1,0,0,
"Good and Excellent,,,,But the only thing is we cannot delete the chat history.Some privacy is needed.",Excellent,5,29,11,2014,9,57,59,6,48,2014-11-29T09:57:59,U.A.E.,Swarnan,1,0,0,
"Try this service, I find it convenient. No need to have 2 phones. A bit technical to set up but once done, there has been no looking back for me.","Good connections, safe and cost effective",5,29,11,2014,9,41,2,6,48,2014-11-29T09:41:02,United Kingdom,PATRICIA,1,0,0,
"If you like to save money on overseas calls, use Rebtel",Moneysaver,5,29,11,2014,8,50,29,6,48,2014-11-29T08:50:29,Canada,Artur,1,0,0,
Rebtel is more cheaper than calling cards. I have not had no problems with the service.,making calls with rebtel is awesome,3,29,11,2014,4,16,46,6,48,2014-11-29T04:16:46,United States,pauline,1,0,0,
Rebels has a good deal.,Rental is international good making call,5,29,11,2014,3,49,43,6,48,2014-11-29T03:49:43,United States,EMMANUEL,1,0,0,
"Rebtel have made my distance from my family much close. with their best international call offers, I can easy speak with my families as long as i wish without worry about my my calls bills","Rebtel have made my distance from my family much close. with their best international call offers, I can easy speak with my families as long as i wish without worry about my my calls bills",4,29,11,2014,2,16,4,6,48,2014-11-29T02:16:04,Canada,Olalekan,1,0,0,
Every year the Video and call quality has got better and better.,Have loved Skype now for 7-8 years!!,5,29,11,2014,1,52,25,6,48,2014-11-29T01:52:25,United States,Ravi,3,0,0,
It is the best international telephone system ever. I can talk to my family all around the country  and the special deals rebtel offer me is unbeatable ...,It is super duper cheap !!!!!,5,29,11,2014,0,52,3,6,48,2014-11-29T00:52:03,Australia,Omaira,1,0,0,
"I would give the Rebtel app a minus rating if one was available.  Since the upgrade it doesn't work on my iPhone 5S and iPhone 4S.  When I click the app to open, it crashes.  I purchased 1000 minutes for 30 days for India which I easily use when the app is working.  Now without a functioning app, I have to login to the web portal for each new person I want to call, create a local number and then call them.  What an annoyance!  After many years with Rebtel, looking for another solution just because of this rubbish upgrade.","Completely rubbish, don't update",1,28,11,2014,22,25,56,5,48,2014-11-28T22:25:56,United States,Bappi Lahiri,1,0,0,
"Rebtel is awesome.  I have experience that when I use a land line it is even more cheaper in terms of rate.  For example when I place $10 on my card I usually talk up to 2hr 15min anytime when I call Nigeria.  I have other long distance calling services, but Rebtel is my preferred",Rebtel #1,4,28,11,2014,20,35,38,5,48,2014-11-28T20:35:38,United States,Aderonke,1,0,0,
"I rate this app with 4 stars as sometimes when i talk with my family, they can't here me. It could be the connection problem or weather condition, but I really like REBTEL. I recommend this app to my friends too. It's an easy way of connecting with family and friends. The best thing about Rebtel is you can see how much time you have talked to someone and how much it coast you.",It is a great way of connecting with my family,4,28,11,2014,19,44,20,5,48,2014-11-28T19:44:20,Canada,Vandana,1,0,0,
I'm in a long distance relationship and rebtel has made communication easier for me. Sometimes I top up but usually I use wifi or my mobile 3G to make international calls. Such a life saver,Great!,3,28,11,2014,19,38,45,5,48,2014-11-28T19:38:45,United Kingdom,Tina,1,0,0,
"I have started using Rebtel from last year and I like it a lot. But one issue I am noticing in Rebtel these days is that during the call I am not able to listen the voice for few seconds, but otherwise service is great. It will be awesome if Rebtel give more discount on international call like before.",Great International Call service,4,28,11,2014,19,37,44,5,48,2014-11-28T19:37:44,Canada,Vijay,1,0,0,
A good and affordable way to stay connected with family.,Stay connected,4,28,11,2014,19,14,3,5,48,2014-11-28T19:14:03,United States,Mercy,1,0,0,
"I have been using Rebtel for making calls to a few countries for last few years and quite satisfied with the cost and quality of calls and services. There are other companies in the market and their cost are competitive and services are good either. So, Rebtel may continuously thrive for being the market leader.",Rebtel is good for low cost overseas calls,4,28,11,2014,17,58,22,5,48,2014-11-28T17:58:22,Australia,"Md, Khalilur Rahman",1,0,0,
"At times when marking international calls, it does not connect properly. Is either I can't hear the person on the other side or they can't hear me. At the same time my credit is been deducted.",Connection at times is poor.,3,28,11,2014,17,50,28,5,48,2014-11-28T17:50:28,United Kingdom,Victoria,1,0,0,
"Ur service is great ,i can vouch for u.",awesome,5,28,11,2014,17,44,47,5,48,2014-11-28T17:44:47,United States,adedoyinsola,1,0,0,
Rebtel has very goo service,Very good service,5,28,11,2014,17,16,8,5,48,2014-11-28T17:16:08,United States,Shreyos,1,0,0,
"Your newly redesigned page makes it easier to see the Account Balance at a glance, and it is more user friendly than before.","Using Rebtel has been a wonderful experience for 3 years running, keep it up !!",5,28,11,2014,16,47,48,5,48,2014-11-28T16:47:48,United States,John Oteniya,2,3,0,
Since I had Rebtel I nev have to worry about scratching card and see if it works or not 5/5 reception guaranteed,Rebtel gave peace of mind,5,28,11,2014,16,45,22,5,48,2014-11-28T16:45:22,United States,Amrane,1,0,0,
I wish you thank Rebtel for their stability. my only problem with Rebtel is it is very expensive calling Africa. I have used Rebtel for almost two years now yet Rebtel never for once added an extra credit to me phone this is a shame. I am highly disappointed in Rebtel,I am highly disappointed,3,28,11,2014,16,41,19,5,48,2014-11-28T16:41:19,United States,Gordian,1,0,0,
This is the best in business,the best in business,4,28,11,2014,16,38,25,5,48,2014-11-28T16:38:25,United States,adhiss,1,0,0,
"i dont like the per minute charge sequence. when a call drops at 10sec, why should it be taken as 60 seconds..... Also, wen the call connects, reception quality shld be above 70% for clarity at both ends",rate and reception,2,28,11,2014,16,37,9,5,48,2014-11-28T16:37:09,Canada,idogho paul,2,0,0,
Every time I have used it to call my relatives the calls always went through.,excellent,4,28,11,2014,16,31,42,5,48,2014-11-28T16:31:42,United States,Justin,1,0,0,
I phone my family everyday from another country. Rebtel allows us to stay in contact with each other all year long with it's fantastic rates and quality calls.,"Reliable, quality affordable calling.",5,28,11,2014,16,16,54,5,48,2014-11-28T16:16:54,United States,james,1,0,0,
This services is one of the best things that has happened to me. I live in Canada and l can call directly from my cell phone. People do tell me you cant do that as you will be paying too much. I say nope l can cause l am using Rebtel haha.,Amenzing service,5,28,11,2014,16,8,29,5,48,2014-11-28T16:08:29,Canada,aka Idode,1,0,0,
"Hello dear, I'm using a network called Rebtel to call you. I can hear you clearly and the beauty of the whole thing is that the charges are very cheap. It saves me a lot of money. I can now talk to you as often as I want without considering the cost. Calls do not drop as I talk, and it takes just seconds to connect my calls. The network is really strong, cheap, and reliable.","Rebtel is strong, clear, cheap, and reliable network in making long distance calls.",5,28,11,2014,16,1,52,5,48,2014-11-28T16:01:52,United States,CHUKWUDI,1,0,0,
its two as expensive than other providers.,its expencives,4,28,11,2014,15,59,0,5,48,2014-11-28T15:59:00,United States,nanda,1,0,0,
Clear as a bell!,Best VOI ever,5,28,11,2014,15,57,55,5,48,2014-11-28T15:57:55,United States,Earnest,1,0,0,
I don't have to buy international phone cards from stores even when I run out credit. Its very easy to refill with PayPal.Rebtel has made long distance calling so much easier and affordable.,convenience,5,28,11,2014,15,57,53,5,48,2014-11-28T15:57:53,United States,Olubukola,1,0,0,
Excellance at its best... A truly convenient & effortless way to talk overseas,Excellance at its best...,5,28,11,2014,15,52,38,5,48,2014-11-28T15:52:38,Australia,Jagdeep,1,0,0,
I would recommend calling India and nairobi,excellent rate and quick clear connect,5,28,11,2014,15,43,6,5,48,2014-11-28T15:43:06,United States,Moosabhoy,1,0,0,
I have been using this app for an year now and it provides seamless quality of calls with very low rates.,Excellent app for international calling,5,28,11,2014,15,36,19,5,48,2014-11-28T15:36:19,United States,Rajat,1,0,0,
You will never regret if you use rebtel,Rebtel is the best,5,28,11,2014,15,27,30,5,48,2014-11-28T15:27:30,United States,Laura,1,0,0,
Shop around for a cheaper deal first,Expensive,3,28,11,2014,15,23,55,5,48,2014-11-28T15:23:55,United States,Frank,1,0,0,
Rebtel is great,Impressive service,5,28,11,2014,15,17,23,5,48,2014-11-28T15:17:23,United States,anthony,2,0,0,
Nice clarity during long distance call,Its good,4,28,11,2014,15,8,42,5,48,2014-11-28T15:08:42,United States,deepak,1,0,0,
It is very good and quality is nice,Karthik,5,28,11,2014,15,7,50,5,48,2014-11-28T15:07:50,Germany,Karthik,2,0,0,
"Communication is clear.  Their service is good. Except their billings which is more  too expensive compared to viber and Facebook messenger. And in rebtel, You get billed  for  phone just  ringing when no one has picked yet or if no one picked at all.",3 stars,3,28,11,2014,15,5,4,5,48,2014-11-28T15:05:04,United States,wendy,1,0,0,
I would recommend rebtel to any and everyone,best phone calling plan,5,28,11,2014,14,51,0,5,48,2014-11-28T14:51:00,United States,Susan,3,0,0,
I love rebtel and I will always recommend it,nice,4,28,11,2014,14,47,31,5,48,2014-11-28T14:47:31,United States,dafe,1,0,0,
I have had a tremendous experience with Rebtel. I will recommend it to friends.,its been such a nice experience.,5,28,11,2014,14,38,23,5,48,2014-11-28T14:38:23,United States,Olufunmilayo Onafowokan,1,0,0,
"a bit costlier than other calling cards, but good service.",A Touch costly for the service,3,28,11,2014,14,36,30,5,48,2014-11-28T14:36:30,United States,Kraje,1,0,0,
"I have used many other before I got know about rebtel. All others have some problem with connection. I need to call more than once to get connected, voice quality was more worst. That too I got more problem when I really required to talk and etc",Simply Awesome Network,5,28,11,2014,14,28,20,5,48,2014-11-28T14:28:20,United States,Narendra,1,0,0,
I call my family members and friend anywhere and anytime with Rebtel without any stress,Rebtel is the best  and affirdable,5,28,11,2014,14,19,19,5,48,2014-11-28T14:19:19,Canada,Comfort,1,0,0,
Worst experience.,Calls are not working.,1,28,11,2014,14,17,40,5,48,2014-11-28T14:17:40,Germany,Jayesh,1,0,0,
Great way to make international calls. Its easy to set up and the rates are great.  The call quality is great.   Its never been easier for me to stay in touch.,Convenient and inexpensive way to make international calls,5,28,11,2014,14,13,34,5,48,2014-11-28T14:13:34,United States,Mary,1,0,0,
"I have been using rebtel as a means of communication for over three years! Rebtel's services are reliable, affordable, and easy to use! Rebtel is among the best and most relevant in the app-based communication industries. I will surely recommend it to all my friends and families!!",Extremely Reliable!,5,28,11,2014,14,12,5,5,48,2014-11-28T14:12:05,United States,Josiah,1,0,0,
I enjoy the ease and flex of calling anywhere in the world,calling international made easy,4,28,11,2014,14,3,30,5,48,2014-11-28T14:03:30,Canada,uche,1,0,0,
Easy customer service will be excellent. But great app overall.,Customer service,5,28,11,2014,14,2,7,5,48,2014-11-28T14:02:07,United States,NAFISAT,1,0,0,
Increase minutes of $10 to Nigeria up to 500 minutes,Minute,2,28,11,2014,12,0,18,5,48,2014-11-28T12:00:18,United States,Peter,1,0,0,
It's just great to be able to call attune I want o at such a cheap rate and speak for as long as I want to. It's amazingly cheap and the connection is clear.,It's very cheap!,4,28,11,2014,11,26,3,5,48,2014-11-28T11:26:03,United States,Zainab Shuaib,1,0,0,
Good card for international calls. I recommend it any of my friends,l like you card very much because it saves me money and line is always clear. G,5,28,11,2014,9,55,27,5,48,2014-11-28T09:55:27,United States,CHARLES Ehule,1,0,0,
Line never clear,Not good at all,1,28,11,2014,9,51,57,5,48,2014-11-28T09:51:57,Australia,ahmed,1,0,0,
Hello Rebtel.,Customer Service Number,4,28,11,2014,3,51,56,5,48,2014-11-28T03:51:56,United States,EDWARD,1,0,0,
"Using Rebtel has made my communication with friends and family outside the United States very convenient, just wish they have a way to conference calls with multiple callers. Overall, I highly recommend this service to anyone because of its convenience and reliability.",Great and convenient way to reach out to family and friends anywhere.,4,27,11,2014,19,56,58,4,48,2014-11-27T19:56:58,United States,Yemi,1,0,0,
Expensive pris.  But other things are cool.,Good,4,27,11,2014,18,42,53,4,48,2014-11-27T18:42:53,Norway,Matiwos,1,0,0,
"Great, efficient and honest service","Great, efficient and honest service",4,27,11,2014,18,30,59,4,48,2014-11-27T18:30:59,United States,Charles,2,0,0,
WHAT I LIKE IS SHARING MINUTES WITH MY LOVED ONES AND FAMILY,I LIKE REBTEL WHEN I CAN USE THE SENDLY MINUTES TO FRIENDS,5,27,11,2014,18,18,47,4,48,2014-11-27T18:18:47,United States,caleb,1,0,0,
Rebtel is good but i want the rates to be cheaper,it should be cheaper,4,27,11,2014,17,52,52,4,48,2014-11-27T17:52:52,United States,BILKISU,1,0,0,
I am pretty happy with the service. I use Rebtel to call my friends and family that have easy access to internet. Good ratio service/price.,Great quality!,5,27,11,2014,16,55,36,4,48,2014-11-27T16:55:36,Kingdom,Arnaud Caillot,3,0,0,
Rebtel is easy to use and delivers a clear connection. Would recommend Rebtel to everyone who calls internationally.,Clear connection and easy to use. Rates are awesome. Love your service!,5,27,11,2014,16,45,43,4,48,2014-11-27T16:45:43,United States,Christine,1,0,0,
Calling some countries is very expensive,Very handy but sound quality needs to improve,3,27,11,2014,15,29,18,4,48,2014-11-27T15:29:18,United States,Farris,1,0,0,
Am a truck driver in America and always on the road rebtel keeps me in touch with my family and friends back in Africa simply breaking home sickness thanks rebtel,simply the best,5,27,11,2014,15,25,5,4,48,2014-11-27T15:25:05,United States,martin,1,0,0,
"I love Rebtel, infact i have used it myself for quite long anf referred so many of my friend to this service. But sadly, these days the rates just went up and it is not more cost effective service for me especially when i get decently comparable services from competitiors like Dial 91 doing the same india call for 1.1 cents against rebtels 1.7 cents.",Awesome service but not cost competitive,4,27,11,2014,15,11,44,4,48,2014-11-27T15:11:44,Canada,Srinivas,1,0,0,
Doing very well with great fecility for oversesse people with very compatitive rstes and good quality. All I can say keep it up. thank you...,Great profuct,5,27,11,2014,14,40,9,4,48,2014-11-27T14:40:09,Australia,Tahir,1,0,0,
"I love the Rebtel app it allows me to keep in touch my family over seas. I recommend to all my friends. Just something I do have issues with connection thus I am happy to do this review so you guys at Rebtel can make the service even better, but thank you so much for creating  this app and have decent pricing.",Rebel is a very good app highly recommend.,5,27,11,2014,14,22,38,4,48,2014-11-27T14:22:38,United States,Qaisr,1,0,0,
Rebtel is super good,Always d best,5,27,11,2014,13,39,32,4,48,2014-11-27T13:39:32,Canada,Racheal,1,0,0,
They are okay,Okay,3,27,11,2014,13,25,36,4,48,2014-11-27T13:25:36,United States,christine,1,0,0,
No customer service either online or to tal and complain in all Rebtel website,"Not always satisfy some time hide my number, that look suspicious at receiver end to pick the call",3,27,11,2014,12,58,42,4,48,2014-11-27T12:58:42,United States,Musa,1,0,0,
I have been using Rebtel for a few months and I gave found it be extremely inconsistent with frequent drop calls. not honest about their charges. I m now looking for an alternative service provider.,Inconsistent service,1,27,11,2014,12,42,15,4,48,2014-11-27T12:42:15,United Kingdom,J Kumar,1,0,0,
good service,pretty good,4,27,11,2014,12,12,41,4,48,2014-11-27T12:12:41,Canada,NAFIZ,1,0,0,
"Don't have worry if you using Rebtel.crystal clear sound, reliable and also money wise very decent. So you can make all the international call anytime.",I can't believe that I hang with a very long time.,5,27,11,2014,11,53,11,4,48,2014-11-27T11:53:11,United States,Arabindu,1,0,0,
Call quality is not good,Call quality is not good,3,27,11,2014,11,38,2,4,48,2014-11-27T11:38:02,United States,Rashed,1,0,0,
It will be better if they can eliminate the international bank fees that's charged to my card. Which is almost a dollar.,extra international fees.,4,27,11,2014,11,14,58,4,48,2014-11-27T11:14:58,United States,airule,1,0,0,
