Review,Title,Rating,day,month,year,hour,minute,second,dayofweek,weekofyear,raw time,Country,Username,Reviews,Reads,Useful,Genre
freee goood ilav you,Ilav,5,4,2,2013,13,34,2,1,6,2013-02-04T13:34:02,United States,Riyad Almalki,1,0,0,
Love using Rebtel it offers great service though its a bit expensive to call countires like Zimbabwe but i do understand because with all other calling companies the rates are high... The lines are clear nd the conection is realy good.. will continue using rebtel and continue to encourage my friends to use it ..,Great Service,5,1,2,2013,20,57,25,5,5,2013-02-01T20:57:25,United States,Rumbie Gurira,1,0,0,
Supper gut...,Austria 6020,5,29,1,2013,1,52,47,2,5,2013-01-29T01:52:47,States,Yusuf Taşçı,1,0,0,
rebtel calling system very good but support department coming for time pass.my account is locked because i call on this no 0025270000063 and support department want why i call on this no and i tell them.but no respond my account is locked before  ten days.not good very bad,no good support department,1,27,1,2013,12,15,45,7,4,2013-01-27T12:15:45,States,Ch Muhammad Hassan,1,0,0,
good!!!!!!!,good,5,26,1,2013,9,9,53,6,4,2013-01-26T09:09:53,United States,吳湯鳳,1,0,0,
I am so glad I found the one and only true cheaper calling international services. I realized that I was spending a lot of money using other services compared to the use of Rebtel calling services. I thank the one who introduced to this wonderful service and I will try my level best to extent this good news to other international and local callers. I love it. Maria.,Wow! this is the only best service wherecheaper international/local calling experiences are concerned,5,23,1,2013,3,6,53,3,4,2013-01-23T03:06:53,United States,Maria Mshanga,1,0,0,
"Guyz this is an amazing gift to all who make distant calls (I mean international calls), but also calls within one's country. Can you imagine free calls from Rebtel to Rebtel.  The calls are clear and faster and above all cheaper. Choose rebtel and experience life as never before. Having said that I wish to suggest that call charges incurred by users for unconnected calls be re-embursed, so could Rebtel please do some reviews and take some appropriate decisions (that includes my account).",CAN NEVER DO WITHOUT IT!,5,20,1,2013,14,53,26,7,3,2013-01-20T14:53:26,States,Godfrey Oduor,1,0,0,
Very cheap calls.,"Cheap calls, good reception. But could improve the sms-service",4,19,1,2013,11,12,43,6,3,2013-01-19T11:12:43,Denmark,Laila Nexø,4,0,1,Female
Hoe is het bla bla bla,Hoi alles oké,5,19,1,2013,5,0,23,6,3,2013-01-19T05:00:23,States,Ibo Aslan,1,0,0,
Love this app...very cheap calls :) awesome hihi i really recommend this app ti anyone :) very great,underfull app,5,18,1,2013,14,59,13,5,3,2013-01-18T14:59:13,United States,Debby E Ruben,1,0,0,
You will not be disappointed with this service and the cost is not bad.,This service is dependable and reliable.,5,18,1,2013,14,13,49,5,3,2013-01-18T14:13:49,United States,Ken Hill,1,0,0,
Only I hope to have a  easy way to use rebtel when I go to the USA. Normally I use Rebtel in China Mailand.,I like using rebtel and also introduced it to my friends. : ),5,17,1,2013,5,7,57,4,3,2013-01-17T05:07:57,United States,Zhu Sun,1,0,0,
Yitzhak587@gmail.com,Yitzhak587gmail.com,5,17,1,2013,5,6,59,4,3,2013-01-17T05:06:59,United States,Itzik Abitbol,1,0,0,
"Being out of your country, far from friends and family is one of the toughest things I've done in my life. Rebtel has played a pivotal role helping to shorten distances at a reasonable price and minimum steps required. I give it 4 stars because i think they could have a rewards system for free minutes other than a referral-based.","Best, faster and cheaper option to call overseas",4,16,1,2013,18,34,32,3,3,2013-01-16T18:34:32,United States,Lizandra J R,1,0,0,
The best offen all ..just love it,best of all,5,16,1,2013,11,41,41,3,3,2013-01-16T11:41:41,United States,D Okk,1,0,0,
I made it all by my self. I asked for my tax number bur couldnt find it where i was told is available. Maybe next time it will be beter.,I dont think the person anwerswering for me undertood my question.,2,16,1,2013,11,31,13,3,3,2013-01-16T11:31:13,United States,Abel Hailemichael,1,0,0,
I found service is quite good better than previous.,"Crystal Clear call, and no voice delay.",5,16,1,2013,10,49,39,3,3,2013-01-16T10:49:39,States,Farhan Alam,1,0,0,Male
I topped up with €20 about two weeks before Christmas (2012) and I spoke to friends and family all over the world!  I dialed and I dialed until they got sick of me. I dialed UK mobiles which I normally find so expensive. Dialing via WiFi occasionally broke up after 3 minutes but only after I'd said what was important.  Dialing via local phone had no problems whatsoever! Always clear! And cheap too!  Recommended the app to friends and fam. I am very satisfied!,Absolutely Brilliant!!,5,16,1,2013,10,22,12,3,3,2013-01-16T10:22:12,Sweden,Mark S,3,0,0,
Very cheap way to send texts from Australia to the Phils,No problems !,5,16,1,2013,9,59,22,3,3,2013-01-16T09:59:22,States,Andrew McMurtrie,2,0,1,Male
I do not want to write a review. You'll have to settle for the 4 stars.,I do not want to write a header,4,16,1,2013,9,34,57,3,3,2013-01-16T09:34:57,United States,Hugh Wilson,1,0,0,
I cannot use the app on my phone it always responds that I have low funds even if I have enough.,"good service, but not good reception.",3,16,1,2013,1,38,21,3,3,2013-01-16T01:38:21,United States,Nomzamo Mavimbela,1,0,0,
"I wish I had found out about Rebtel earlier because, since downloading on my Android smartphone, I've saved a small fortune in international calls to Mauritius.  The best part is you can make FREE international calls if the recipient (anywhere in the world) has Rebtel.",Rebtel - Undeniably THE Best!!!,5,13,1,2013,20,12,14,7,2,2013-01-13T20:12:14,States,Yousouff Mahamedally,1,0,0,
it is very good and very helpful to family in India,Middle East country is little expense,4,11,1,2013,21,22,53,5,2,2013-01-11T21:22:53,United States,Shanmugam Narayanaswamy,1,0,1,
"Think of it as the world's easiest calling card.  You don't have to put in long, complicated access codes.  Rebtel simply provides you with a US-based number to dial and then behind the scenes it makes the international connection for you.  The rates are good and sound quality is usually high.",Outstanding and creative service,5,11,1,2013,19,27,41,5,2,2013-01-11T19:27:41,United States,Reese Kaplan,1,0,0,
the voice is very clear when on the phone with love ones.Thank you for the service.,i am happy about your service,5,11,1,2013,19,11,4,5,2,2013-01-11T19:11:04,United States,Jeremiah Boakye-Nkansah,1,0,0,
I like rebtel service but I really hate how you guys increased the calling rate to China after more and more Chinese people started using ur service. Now I hardly tell any of my friends about rebtel cuz the price is not competitive anymore.,huge price increase?,2,11,1,2013,18,58,22,5,2,2013-01-11T18:58:22,United States,Xinnan Li,1,0,0,
Keep up the good work :),"Good quality, Services and avialbilty on differen devices/ numbers. Grate web page",4,11,1,2013,16,11,7,5,2,2013-01-11T16:11:07,United States,Hadi Hadidi,1,0,0,
Very affordable rates.,good deal & service.,4,11,1,2013,14,9,20,5,2,2013-01-11T14:09:20,United States,Gelgelu Felema,1,0,0,
"I have also logged a request #117320. Unfortunately, it just ended with my question.",Not that Good quality,1,10,1,2013,17,58,23,4,2,2013-01-10T17:58:23,States,Rajendra Vara Prasad E,1,0,0,
"I like to use Rebtel because it is easy to use, no faffing with phone cards just setup and your ready to go!!",GREAT  SITE........ LOVE REBTEL,4,7,1,2013,23,51,31,1,2,2013-01-07T23:51:31,United States,Fiona Brown,1,0,0,
hi i it very much,its very good,5,7,1,2013,6,54,4,1,2,2013-01-07T06:54:04,United States,Denis German,1,0,0,
This is awesome can you believe it il love you,It's very very very good !!!!,5,6,1,2013,9,46,58,7,1,2013-01-06T09:46:58,United States,Akram Haddouch,1,0,0,
"Great call quality, great customer service, great connection and perfect service. one of the best service out there.",Great Service All around,5,5,1,2013,0,8,3,6,1,2013-01-05T00:08:03,United States,Guens Pierre,1,0,0,
"Hey. I am disappointed,stating once again that favourable rates on calls to Sierra Leone don't really exist. I recall having seen an offer of 0,18 € which would have been GREAT but it appeared to raise to 0,28 in reality. Also, when speaking for 1.03 minutes I am charged for 2 minutes, which I don't approve of  at all. That's not the case with hotcom.fi, which remains my favorite operator.",less favourable than expected,3,4,1,2013,14,37,17,5,1,2013-01-04T14:37:17,United States,Sanna Peitso-Sesay,1,0,1,
Calling quality was nice and clear. Also Rebtel was the cheapest places I found to make international calls. I had an issue with calling a number and customer service was very good in solving my problem. Great Company.,"Great calling quality, Great customer service!",5,3,1,2013,6,50,16,4,1,2013-01-03T06:50:16,United States,Zerocool,1,0,0,
I allways waste my money with bad connection.,Your service is not so good quantity.,2,3,1,2013,4,40,10,4,1,2013-01-03T04:40:10,United States,Phuong Thi Tran,1,0,0,
Ur service is so wonderful.,Excellent,5,2,1,2013,17,11,32,3,1,2013-01-02T17:11:32,United States,Angela Ojigho,1,0,0,
Ease of connecting calls and top up of credit makes rebtel a very reliable choice for all my international calls.,nice extremely satisfied with calls and seamless recharging and top-up,5,2,1,2013,15,24,8,3,1,2013-01-02T15:24:08,United States,Emorutowho Maya,1,0,0,
"This is bs, I signed up with Rebtel and if you called a number and doesn't get through, you are still being charged. Why is that, this is bogus. I may have to go back to card or go through another system. Every minute counts for me.",Why Rebtel charged you when you called a phone number and doesn't get through.,3,2,1,2013,15,9,48,3,1,2013-01-02T15:09:48,United States,Claudette Parchment-Roehrich,1,0,0,
I have no complain doing business with Rebtel. Rebtel made it easier for me to communicate with my family members around the world.,Great customer service.,5,2,1,2013,14,5,33,3,1,2013-01-02T14:05:33,United States,Josephine Ottah,1,0,1,
"I've been using Skype for a long time here in China, but from time to time the internet connection just isn't enough.","Smart, flexible, cheap and with a sound quality that even tops Skype.",5,2,1,2013,13,42,35,3,1,2013-01-02T13:42:35,United States,Lars Wattsgard,1,0,1,
Good good good,Good,5,31,12,2012,21,23,50,1,1,2012-12-31T21:23:50,United States,Taikam Chan,1,0,1,
"I don't know if these guys have paid for the reviews, since me and all my friends using their service had really bad experiences. We don't have anything good to say about them, they don't even have a phone number that you can call for customer service, goes out to say that they are really afraid of dealing with unhappy customers so they only have emails through which you can contact them. I would not recommend using Rebtel to anyone. I am discontinuing with them.","Crappiest service ever, calls never connect",1,30,12,2012,12,2,54,7,52,2012-12-30T12:02:54,States,Iheartchocolate Solanki,1,0,1,
"The rates and quality of the calls are outstanding, and no other service i tried comes close to Rebtel in this. The only downside is the signup on the web which is really confusing.  But I am happy customer!",All perfect except one thing!,5,28,12,2012,9,28,50,5,52,2012-12-28T09:28:50,United States,Anders Tolgstad,1,0,0,
I like it some but,Fghjjchjkjh,5,28,12,2012,5,6,21,5,52,2012-12-28T05:06:21,States,Kristina Mishina,1,0,0,
Awesomee.. Should try!,Awesomee.. Should try!,4,27,12,2012,4,36,20,4,52,2012-12-27T04:36:20,States,July Wardhana Salim,1,0,0,
Super bir şey herkesin girmesini isteim. Harikaydı bence,Super iyki yapmışlar,5,26,12,2012,17,9,9,3,52,2012-12-26T17:09:09,States,Ceyhun Gözegir,1,0,0,
Not satisfied with the information given on how to connect free calls to other rebtel users.,need to improve on the information given on how to connect  free calls to other rebtel. user.,4,24,12,2012,8,35,55,1,52,2012-12-24T08:35:55,United States,Abosede Onafuye,1,0,0,
You have really helped me connect my friends. Any chrismas bonus? Can we get more cheaper services? Thanks alot and Merry Chrismas to all.,very satisfying,5,24,12,2012,0,26,27,1,52,2012-12-24T00:26:27,United States,Franklin Emereuwa,1,0,0,
Rebtel is likely and user friendly .its app on windows is powerfull but moblie app  some times can not cross the web filtering on some cauntry .,"is better that Rebtel have WEB application for calling ,after that the user can user rbtel on any device can connect to internet.and also give promotion somtime",3,23,12,2012,5,9,56,7,51,2012-12-23T05:09:56,United States,Mohammad Ali,1,0,0,
Excellent service!,Excellent service!,5,22,12,2012,16,12,5,6,51,2012-12-22T16:12:05,United States,Pawan Mirchandani,1,0,0,
t is very nice service that I am recommending people to use.,worlds best,5,22,12,2012,15,29,54,6,51,2012-12-22T15:29:54,States,Izbah Abbasi,1,0,0,
"Nice, but somehow expensive!",Convenient!,4,21,12,2012,19,43,41,5,51,2012-12-21T19:43:41,United States,Virg Dongmo,1,0,0,
"Rebtel is so good, cheap and affordable. i get to call back home at very low rates than any other service.",its a great service!,5,21,12,2012,18,22,18,5,51,2012-12-21T18:22:18,United States,Marvin Ssemadaali,1,0,0,
"I am using your service and i am based in china , i dont know why but every time i call anywhere in the world it will always waste 2-3 calls first and on 4th attempt it will connect to my desired destination number. I dont know is this policy of your company to make more money or what . If like this one call actually costing me 1$ because first three attempt it will just connect but no voice or it connect and dropped itself.",WORST SERVICE IN CHINA,1,20,12,2012,6,12,7,4,51,2012-12-20T06:12:07,United States,Farhan Bilwani,1,0,0,
Very clear and fast connection to call Cuba but price is a little higher compared with other companies that cater telephony to Cuba,High Quality connection!!! Pricey Service!!!,4,20,12,2012,3,46,24,4,51,2012-12-20T03:46:24,United States,William Barrizonte-Rojas,1,0,0,
It is very nice service that I am recommending  people to use. the purchase process is easy and the system allows you to view your usage so you can trace your calls.,"My best choice, Rebtel!",5,20,12,2012,2,27,51,4,51,2012-12-20T02:27:51,United States,Elias Haile,1,0,0,
do not go there they charged me 100.00 for 50.00,thiefs,1,20,12,2012,0,14,31,4,51,2012-12-20T00:14:31,United States,mike donal,1,0,0,
i spaking my friand and ????,pakistan,5,19,12,2012,23,20,18,3,51,2012-12-19T23:20:18,France,Asif Ali,1,0,0,Male
"Such an easy system to set up, clear and precise website, can't believe how cheap they are to use. A little disappointed with the virtually non existent SMS service. Tried to use it several times with either message arriving days late or not at all. Would appreciate improvement on SMS service. Call system really good, clear line, don't really have any complaints for land lines or cell calls and such a good deal.","Fabulous, wished I'd discovered them before",5,19,12,2012,22,24,47,3,51,2012-12-19T22:24:47,United States,Janet,1,0,0,
Aaaaaaaaaaaa,Aaaaaa,5,19,12,2012,19,6,13,3,51,2012-12-19T19:06:13,United States,張家斌,1,0,0,
"it is so easy & simple as local call, so clear & no delay.",easy & simple,5,19,12,2012,18,21,41,3,51,2012-12-19T18:21:41,United States,Hani Amin,1,0,0,
Best rates we found yet And phone clarity is amazing,Very easy to use and reload the card,5,19,12,2012,11,14,42,3,51,2012-12-19T11:14:42,United States,Erin Hersey,1,0,0,
been using rebtel for years and i am very satisfied with there service.could recommend to anyone.the only problem has been the service interruption  in south africa.,rebtel are the rebels,5,19,12,2012,10,36,43,3,51,2012-12-19T10:36:43,United States,Manfred Buhler,1,0,0,
Awesome think you younitedstate,Awesome,5,19,12,2012,9,33,43,3,51,2012-12-19T09:33:43,United States,Osama Marzoogi,1,0,0,
I liked the techniques that are used in the application,Good thungs to operate,5,17,12,2012,11,17,49,1,51,2012-12-17T11:17:49,States,Rohit Nanda,1,0,0,
This plan is reasonable for me right now. It seems to meet my need for now.,I like it so far.,5,15,12,2012,4,44,11,6,50,2012-12-15T04:44:11,United States,Pheap Chhorm,1,0,0,
"Please I can not call effectively from my PC this makes you poor compared to skpe improve your system. when I call i hear the listener by he/she can,t hear me which is not the case with skype. In addition I also feel my minutes were not exhausted from the account history.",POOR SERVICES,3,15,12,2012,3,38,35,6,50,2012-12-15T03:38:35,United States,Godwin Okochi,1,0,0,
I talk to my husband in Cuba everyday. Very good price.,very good,5,13,12,2012,16,11,18,4,50,2012-12-13T16:11:18,United States,Yothikka Vethanayagam,1,0,0,
some times we need to talk to you,how to contact  by phone,4,13,12,2012,2,16,16,4,50,2012-12-13T02:16:16,United States,Syed Wajid Hussain,1,0,1,
It is a very good site to call world wide .,very good,4,12,12,2012,21,36,19,3,50,2012-12-12T21:36:19,United States,Surjit Singh,1,0,0,
I like Rebtel service. I think it would be great if anyone calling internationally would use it,Great service,5,12,12,2012,21,1,53,3,50,2012-12-12T21:01:53,United States,Ernest West,3,0,0,
"ever since I switched to Rebtel, I have been able to make long distant calls with so much ease .I love using it .",THE BEST SOLUTION TO LONG DISTANCE CALLING,5,12,12,2012,20,53,12,3,50,2012-12-12T20:53:12,United States,Fauzia Irshad,1,0,0,
"I'm impressed with the service, and the rates charged. I wish it was cheaper to Cuba, but its still cheaper than anywhere else I have found. I have had a few dropped calls, but I believe that is because of using WiFi, as I have not had any dropped calls while using my local minutes. Over all I'm impressed.",Great Service,5,12,12,2012,19,6,23,3,50,2012-12-12T19:06:23,United States,Martin Flanagan,1,0,0,
Great service delivery at competitive pricing. With improved technology I believe the price may further reduce and make room for vedio calls,The best of its kind in terms of service delivery and competitive pricing,4,12,12,2012,18,27,41,3,50,2012-12-12T18:27:41,United States,Olaposi Omotuyi,1,0,0,
AS PER MY VOIP EXPERIENCE IN INTERNATIONAL CALL I SAID THAT REBTEL PROVVIDE HI STANDARD PERFORMANCE,HIGH VOICE QUALITY,5,12,12,2012,17,31,3,3,50,2012-12-12T17:31:03,United States,Roberto Nassivera,1,0,0,
the rates are going higher otherwise i would give a 5 star,perfect,4,12,12,2012,17,31,2,3,50,2012-12-12T17:31:02,States,Shidvash T,2,0,0,Female
Works pretty well with talking to family overseas.,GREAT,4,12,12,2012,8,38,53,3,50,2012-12-12T08:38:53,United States,Idongesit Ukpong,1,0,0,
"I have assessed your call rates and other rates obtained online, I found to my disappointment that your rates are much higher and even at that the call minutes are much shorter than what is stipulated on your calling rate, I do not understand why it is so. When I bought a $25 card It doesnt last me upto 2hours and before i could make one or two calls, the entire minutes on my card is already exhanused. Im suprised that a $25 card canm not even last me for 2hours",good but costly,2,10,12,2012,15,27,1,1,50,2012-12-10T15:27:01,United States,Christopher Egbulefu,1,0,1,
"Initially I was skeptical about signing up for this service, but I like it after I tried it, it is very convenient for international calls",go rebtel,5,9,12,2012,15,34,56,7,49,2012-12-09T15:34:56,United States,Adaugo Ibe,1,0,0,
So good  非常喜歡人物角色扮演^•^,Good game,5,8,12,2012,19,28,41,6,49,2012-12-08T19:28:41,United States,黃小強,1,0,0,
Never made free calls with me,Never made free calls with me,2,8,12,2012,16,1,32,6,49,2012-12-08T16:01:32,United States,Abdulazeem Abdoh,1,0,0,
"Rebtel is transparent in their pricing, better value than calling cards","Magnificient, value for money and better than those ripped off calling cards",5,6,12,2012,22,49,49,4,49,2012-12-06T22:49:49,United States,Jimmy George,1,0,0,
Good deal Good deal,Good deal,5,6,12,2012,15,23,34,4,49,2012-12-06T15:23:34,United States,Kenna Aniagoh,1,0,0,
i like the crystel clear talk,rebtel brings home closer,5,6,12,2012,2,24,17,4,49,2012-12-06T02:24:17,United States,Rakesh Chopra,1,0,0,
So far so good.I had a problem with allowing someone to reply to my sms by taking it out of my account..Dont know if it is corrected.I was told by rebtel that it is fixed.,Pretty good,4,5,12,2012,15,26,58,3,49,2012-12-05T15:26:58,United States,Robert Robinson,1,0,0,
"Since I started your international calls, I always get excellent service.",It is great.,5,5,12,2012,14,46,0,3,49,2012-12-05T14:46:00,United States,Fantaye Mersha,1,0,0,
Absolutely happy with Rebtel's product and service,Easy to use and cheaper than the competition,5,5,12,2012,14,1,24,3,49,2012-12-05T14:01:24,United States,Chris Hall,2,0,0,
"If you call friends and family abroad, then this is the VOIP provider to use. iPhone, Android and access via normal land-line phones.",Best VOIP international Provider for calling abroad.,5,5,12,2012,11,42,39,3,49,2012-12-05T11:42:39,United States,Mr Miah,1,0,0,
So far I happy with the service of rebtel,Good service,4,5,12,2012,1,28,48,3,49,2012-12-05T01:28:48,United States,Ibrahim Ali,1,0,0,
"A friend recommended Rebtel : a friend indeed. I now use Rebtel for all my mobile to mobile calls to my daughter in Australia. good contact, good reception.",A wizard way to contact Oz,5,2,12,2012,16,39,52,7,48,2012-12-02T16:39:52,United States,James Allan,2,0,0,
5 star with no exception!,Just outstanding service!!,5,29,11,2012,3,41,30,4,48,2012-11-29T03:41:30,United States,Tafesse Wolde,1,0,0,
Need more discount,Good,4,29,11,2012,1,18,0,4,48,2012-11-29T01:18:00,United States,Ifeanyi Chukwuka,1,0,0,
Rebtel is good and cheaper for calling international lines....but what I don't like is d ideal of having to create local num..for each international calls u want to make...d management should create one particular parmanent access code for all international calls...so it will improve rebtel seevices................thanks.,to improve on geting local num for international calls,3,28,11,2012,18,44,40,3,48,2012-11-28T18:44:40,United States,Shodmu Temidayo,1,0,0,
good service thank's,GOOD,4,28,11,2012,18,27,8,3,48,2012-11-28T18:27:08,United States,Arif Zeshan,1,0,1,
"I have $5.00 in my account which is about for 1 1/2 hours talk time to Japan, but I had to add more credit in order to make a phone call to Japan. I believe this $5.00 is the money I will lose when I cancel the service because I don't think they offer a refund.","$5.00 credit in my account, but can't make a phone call...",2,28,11,2012,17,0,3,3,48,2012-11-28T17:00:03,United States,Minnmama,1,0,0,
I really like them,This is very easy way to call outside of united state and very cheap but good connection call,5,28,11,2012,15,55,58,3,48,2012-11-28T15:55:58,United States,Jacek Kozik,1,0,0,
The website's interface is very user-friendly. The whole process from saving overseas phone numbers to getting local numbers and saving them in your phone is extremely intuitive. Pricing is very reasonable.,"Reasonable, easy and convenient",5,28,11,2012,14,49,46,3,48,2012-11-28T14:49:46,United States,Denis Rozin,1,0,0,
"easy and cheap way to phone to my friend in Kenya, good clear connection",easy and cheap way to phone to my friend in Kenya,4,28,11,2012,12,24,25,3,48,2012-11-28T12:24:25,United States,Rita Versaen,1,0,0,
"Lately, the rate to call Japan was raised from 2 cents to 7 cents - 3 times higher. Yet, the quality became worse. On my recent call to Japan, I was able to hear my mother on the other end, but she did not hear me at all, so she hung up - 7 cents for this. Both of us could hear each other on the 2nd call. Then my phone lost battery, so the call was terminated, and I called again. Same as the 1st call - my mother did not hear me - another 7 cents for nothing. I called back and it worked okay for a while, but my balance was getting low, so I added funds ($10) during the call. Guess what? The call was ended by Rebtel when the balance dropped to $10.03. Yes, there were beeps and notifications, and also automated operator was asking me to add funds. I already added funds online, so I did not add more funds on the phone. I switched from Google Voice due to the fact I had to close my Google accout. Rebtel calls worked better at the same rate of 2 cents a minute as Google Voice, before the rate went up to 7 cents. It does not make sense to me.",No Sound,2,28,11,2012,12,18,25,3,48,2012-11-28T12:18:25,United States,Kazuyo Suzuki-Larson,1,0,0,
Nice not great yet. I hope we get there.,Nice.,4,28,11,2012,11,0,43,3,48,2012-11-28T11:00:43,United States,Micah S,1,0,0,
Very helpful mechanism to reach distant family members.,Helpful,4,25,11,2012,18,32,4,7,47,2012-11-25T18:32:04,United States,Isis Val,1,0,0,
"when you make  a call, there is no connection at all. You never know other person is on other call or switched off or out of coverage area.  I did make many calls, not all numbers are engaged but call never connects. One more thing if you have multiple accounts , local numbers assigned get mixed  up.",Sometimes it has not reliable service,1,24,11,2012,8,55,40,6,47,2012-11-24T08:55:40,United States,Raman,1,0,0,
"Very good,and me so like,but tai Che Dan le,shi Zaire  bugan. Xiangxiang",Liucong,4,22,11,2012,20,12,8,4,47,2012-11-22T20:12:08,United States,Miss liu,1,0,0,
I love this rout of communicating with the pinless card.  It's kwao! it has made it easy after saving all the frequently used numbers its just like snapping a finger and the cup of warm tea appears.,IT'S KWAO - GIVE IT A SHOT!,5,21,11,2012,3,49,45,3,47,2012-11-21T03:49:45,United States,Mary Bridges,1,0,0,
